{
  "format": "bonis-oculis-skip",
  "version": 1,
  "id": "6b0c1f2e-3d4a-4b5c-8d6e-000000000006",
  "created": "2026-10-01T09:00:00.000Z",
  "modified": "2026-10-12T12:00:00.000Z",
  "generator": {
    "app": "bonis oculis",
    "appVersion": "0.2.0",
    "analyzerVersion": "0.2.0",
    "modelSet": "v2"
  },
  "media": {
    "title": "Reviewed (rejected and locked)",
    "duration": 1000.5,
    "fingerprint": {
      "size": 734003200,
      "oshash": "8e245d9679d31e12",
      "headSha256": "0000000000000000000000000000000000000000000000000000000000000001"
    },
    "filename": "reviewed.mkv"
  },
  "ranges": [
    {
      "id": "rn0001",
      "start": 101,
      "end": 111,
      "category": "nudity",
      "confidence": 0.85,
      "action": "skip",
      "source": "auto",
      "review": "pending"
    },
    {
      "id": "ro0002",
      "start": 200,
      "end": 210,
      "category": "gore",
      "confidence": 0.6,
      "action": "none",
      "source": "auto",
      "review": "rejected"
    },
    {
      "id": "rn0004",
      "start": 205,
      "end": 209,
      "category": "nudity",
      "confidence": 0.9,
      "action": "skip",
      "source": "auto",
      "review": "pending"
    },
    {
      "id": "rn0003",
      "start": 209,
      "end": 230,
      "category": "gore",
      "confidence": 0.7,
      "action": "skip",
      "source": "auto",
      "review": "pending"
    },
    {
      "id": "ro0003",
      "start": 300,
      "end": 310,
      "category": "kissing",
      "confidence": 0.7,
      "action": "skip",
      "source": "auto",
      "review": "approved"
    },
    {
      "id": "ro0004",
      "start": 400,
      "end": 420,
      "category": "sex",
      "confidence": 0.75,
      "action": "skip",
      "source": "auto",
      "review": "pending",
      "locked": true,
      "note": "Edges adjusted by a parent."
    },
    {
      "id": "rn0006",
      "start": 420,
      "end": 430,
      "category": "sex",
      "confidence": 0.9,
      "action": "skip",
      "source": "auto",
      "review": "pending"
    },
    {
      "id": "ro0005",
      "start": 500,
      "end": 505,
      "category": "other",
      "confidence": 1,
      "action": "skip",
      "source": "manual",
      "review": "pending"
    },
    {
      "id": "ro00051",
      "start": 550,
      "end": 560,
      "category": "gore",
      "confidence": 0.5,
      "action": "skip",
      "source": "auto",
      "review": "pending"
    },
    {
      "id": "ro0006",
      "start": 600,
      "end": 603,
      "category": "other",
      "confidence": 1,
      "action": "skip",
      "source": "panic",
      "review": "approved"
    },
    {
      "id": "ro0007",
      "start": 700,
      "end": 702,
      "category": "language",
      "confidence": 1,
      "action": "mute",
      "source": "imported",
      "review": "pending"
    },
    {
      "id": "rn0009",
      "start": 805,
      "end": 815,
      "category": "implied",
      "confidence": 0.45,
      "action": "skip",
      "source": "auto",
      "review": "pending"
    },
    {
      "id": "ro0009",
      "start": 900,
      "end": 910,
      "category": "nudity",
      "confidence": 0.65,
      "action": "none",
      "source": "auto",
      "review": "approved",
      "locked": true
    },
    {
      "id": "rn0010",
      "start": 990,
      "end": 1000.5,
      "category": "gore",
      "confidence": 0.66,
      "action": "skip",
      "source": "auto",
      "review": "pending"
    }
  ],
  "scan": {
    "status": "complete",
    "finishedAt": "2026-10-12T12:00:00.000Z"
  },
  "history": [
    {
      "at": "2026-10-01T09:00:00.000Z",
      "event": "created"
    },
    {
      "at": "2026-10-01T09:00:00.000Z",
      "event": "scanned",
      "detail": "kept 0, replaced 0, added 9, dropped 0"
    },
    {
      "at": "2026-10-01T10:30:00.000Z",
      "event": "rejected",
      "rangeId": "ro0002"
    },
    {
      "at": "2026-10-01T10:30:00.000Z",
      "event": "approved",
      "rangeId": "ro0003"
    },
    {
      "at": "2026-10-01T10:30:00.000Z",
      "event": "edited",
      "rangeId": "ro0004"
    },
    {
      "at": "2026-10-12T12:00:00.000Z",
      "event": "scanned",
      "detail": "kept 7, replaced 2, added 7, dropped 3"
    }
  ],
  "summary": {
    "nudity": {
      "count": 2,
      "seconds": 14,
      "maxIntensity": 0
    },
    "sex": {
      "count": 2,
      "seconds": 30,
      "maxIntensity": 0
    },
    "implied": {
      "count": 1,
      "seconds": 10,
      "maxIntensity": 0
    },
    "kissing": {
      "count": 1,
      "seconds": 10,
      "maxIntensity": 0
    },
    "gore": {
      "count": 3,
      "seconds": 41.5,
      "maxIntensity": 0
    },
    "language": {
      "count": 1,
      "seconds": 2,
      "maxIntensity": 0
    },
    "other": {
      "count": 2,
      "seconds": 8,
      "maxIntensity": 0
    }
  }
}
