{
  "format": "bonis-oculis-skip",
  "version": 1,
  "id": "6b0c1f2e-3d4a-4b5c-8d6e-000000000002",
  "created": "2026-10-01T09:00:00.000Z",
  "modified": "2026-10-01T10:30:00.000Z",
  "generator": {
    "app": "bonis oculis",
    "appVersion": "0.1.0",
    "analyzerVersion": "0.1.0",
    "modelSet": "v1-2026-10"
  },
  "media": {
    "title": "Full Example (every field)",
    "year": 1999,
    "duration": 5400,
    "filename": "Full Example (1999).mkv",
    "offset": 0,
    "fingerprint": {
      "size": 1468006400,
      "oshash": "00ff00ff12345678",
      "headSha256": "e3b0c44298fc1c149afbf4c8996fb92427ae41e4649b934ca495991b7852b855",
      "sceneCuts": [
        0,
        4.2,
        10.5,
        61.04,
        120,
        600.5,
        1200.25,
        2700,
        4000.75,
        5399.9
      ]
    }
  },
  "ranges": [
    {
      "id": "rnud00001",
      "start": 600.5,
      "end": 640.25,
      "category": "nudity",
      "confidence": 0.93,
      "action": "skip",
      "source": "auto",
      "review": "pending",
      "intensity": 3,
      "cutStart": 600.5,
      "cutEnd": 640.25,
      "signals": {
        "frames": 0.97,
        "subtitles": 0.2,
        "audio": 0.1,
        "speech": 0,
        "captions": 0.8
      },
      "note": "Nudity detected in the picture."
    },
    {
      "id": "rsex00001",
      "start": 1200.25,
      "end": 1260,
      "category": "sex",
      "confidence": 0.81,
      "action": "hide",
      "source": "auto",
      "review": "approved",
      "intensity": 2,
      "note": "Dialogue and sound suggest intimacy."
    },
    {
      "id": "rimp00001",
      "start": 1500,
      "end": 1512.5,
      "category": "implied",
      "confidence": 0.55,
      "action": "blur",
      "source": "auto",
      "review": "pending",
      "intensity": 1
    },
    {
      "id": "rkis00001",
      "start": 2000,
      "end": 2008,
      "category": "kissing",
      "confidence": 0.62,
      "action": "none",
      "source": "auto",
      "review": "rejected",
      "intensity": 1
    },
    {
      "id": "rgor00001",
      "start": 2700,
      "end": 2731.75,
      "category": "gore",
      "confidence": 0.71,
      "action": "skip",
      "source": "auto",
      "review": "approved",
      "intensity": 3,
      "locked": true,
      "note": "A violent injury is shown."
    },
    {
      "id": "rlan00001",
      "start": 3000.4,
      "end": 3001.6,
      "category": "language",
      "confidence": 0.9,
      "action": "mute",
      "source": "imported",
      "review": "pending"
    },
    {
      "id": "roth00001",
      "start": 4000.75,
      "end": 4010,
      "category": "other",
      "confidence": 1,
      "action": "skip",
      "source": "manual",
      "review": "approved"
    },
    {
      "id": "roth00002",
      "start": 4500,
      "end": 4503.5,
      "category": "other",
      "confidence": 1,
      "action": "skip",
      "source": "panic",
      "review": "approved",
      "locked": false
    }
  ],
  "language": "es-MX",
  "scan": {
    "status": "complete",
    "startedAt": "2026-10-01T09:00:00Z",
    "finishedAt": "2026-10-01T10:29:59.5+02:00",
    "stages": {
      "subtitles": {
        "status": "done",
        "progress": 1,
        "seconds": 12.5,
        "model": "qwen3-0.6b-q4",
        "detail": "track 2 (es)"
      },
      "frames": {
        "status": "done",
        "progress": 1,
        "seconds": 2400,
        "model": "nudenet-320n"
      },
      "audio": {
        "status": "skipped",
        "detail": "disabled in settings"
      },
      "speech": {
        "status": "skipped"
      },
      "captions": {
        "status": "failed",
        "progress": 0.4,
        "resumeAt": 2160,
        "detail": "model missing"
      },
      "fusion": {
        "status": "done",
        "progress": 1,
        "seconds": 0.8
      }
    },
    "levels": {
      "nudity": "strict",
      "sex": "strict",
      "implied": "moderate",
      "kissing": "light",
      "gore": "moderate",
      "language": "off"
    },
    "device": "cpu",
    "warnings": [
      "captions stage failed; implied scenes may be missed"
    ]
  },
  "summary": {
    "nudity": {
      "count": 1,
      "seconds": 39.75,
      "maxIntensity": 3
    },
    "sex": {
      "count": 1,
      "seconds": 59.75,
      "maxIntensity": 2
    },
    "implied": {
      "count": 1,
      "seconds": 12.5,
      "maxIntensity": 1
    },
    "kissing": {
      "count": 0,
      "seconds": 0,
      "maxIntensity": 0
    },
    "gore": {
      "count": 1,
      "seconds": 31.75,
      "maxIntensity": 3
    },
    "language": {
      "count": 1,
      "seconds": 1.2,
      "maxIntensity": 0
    },
    "other": {
      "count": 2,
      "seconds": 12.75,
      "maxIntensity": 0
    }
  },
  "history": [
    {
      "at": "2026-10-01T09:00:00.000Z",
      "event": "created"
    },
    {
      "at": "2026-10-01T10:29:59Z",
      "event": "scanned",
      "detail": "kept 0, replaced 0, added 8, dropped 0"
    },
    {
      "at": "2026-10-01T10:31:00Z",
      "event": "approved",
      "rangeId": "rsex00001"
    },
    {
      "at": "2026-10-01T10:32:00Z",
      "event": "rejected",
      "rangeId": "rkis00001"
    },
    {
      "at": "2026-10-01T10:33:00Z",
      "event": "edited",
      "rangeId": "rgor00001",
      "detail": "end +0.5 s"
    },
    {
      "at": "2026-10-01T10:34:00Z",
      "event": "added",
      "rangeId": "roth00001"
    },
    {
      "at": "2026-10-01T10:35:00Z",
      "event": "panic",
      "rangeId": "roth00002"
    },
    {
      "at": "2026-10-01T10:36:00Z",
      "event": "deleted",
      "rangeId": "rdel00001"
    },
    {
      "at": "2026-10-01T10:37:00Z",
      "event": "imported",
      "detail": "language marks from extension"
    },
    {
      "at": "2026-10-01T10:38:00Z",
      "event": "exported",
      "detail": "kodi edl"
    },
    {
      "at": "2026-10-01T10:39:00Z",
      "event": "offsetChanged",
      "detail": "offset 0 -> 0"
    }
  ]
}
